{
  "$schema": "../backup-ownership-readiness-review.schema.json",
  "schema_version": 1,
  "review_id": "OWN.BACKUP_READINESS_REVIEW.NOCLAIM_TEMPLATE.2026_07",
  "status": "no_claim_backup_ownership_readiness_template",
  "updated": "2026-07-18",
  "claim_status": "Backup-ownership readiness-review template only; no owner review, no independent review, no security review, no release-operations review, no legal review, no support review, no all-critical-scope review, no named qualified backups, no owner identity verification, no role level review, no subsystem competence review, no representative path coverage, no recent review record, no availability record, no succession evidence, no recusal review, no inactive owner replacement, no CODEOWNERS reconciliation, no review-rule reconciliation, no escalation-policy reconciliation, no repository-access review, no stale privileged access review, no ownerless protected-path review, no primary-only path review, no two-person control, no owner coverage claim, no release authority claim, no release promotion claim, no stable signing authority claim, no update trust claim, no supported-version changes claim, no security-disclosure authority claim, no irreversible migration approval claim, no legal approval claim, no incident closure authority claim, no production authority claim, no broad readiness claim, and no implementation claim.",
  "source_records": [
    ".github/CODEOWNERS",
    "docs/research/backup-ownership-gap-inventory-2026-07.md",
    "docs/project-buildout/machine/backup-ownership-gap.schema.json",
    "docs/project-buildout/machine/backup-ownership-gap.json",
    "docs/project-buildout/machine/backup-owner-qualification-record.schema.json",
    "docs/project-buildout/machine/backup-owner-qualification-records/no-claim-backup-owner-qualification-template.json",
    "docs/project-buildout/machine/backup-ownership-readiness-review.schema.json",
    "docs/project-buildout/machine/backup-ownership-readiness-reviews/no-claim-backup-ownership-readiness-template.json",
    "docs/blueprint-v1/machine/professional-owners.json",
    "docs/blueprint-v1/machine/professional-review-rules.json",
    "docs/blueprint-v1/machine/pre-build-readiness.json",
    "docs/blueprint-v1/machine/build-readiness-task-queue.json",
    "docs/blueprint-v1/machine/research-readiness-crosswalk.json",
    "docs/project-buildout/README.md",
    "docs/project-buildout/02-ownership-codeowners-and-maintainer-ladder.md",
    "docs/project-buildout/08-release-incident-legal-data-and-support.md",
    "docs/agent-execution/README.md",
    "docs/production-readiness/README.md",
    "tools/validate_backup_ownership_gap.py",
    "tools/validate_backup_ownership_readiness_review.py",
    "tools/validate_blueprint.py",
    "tools/check.ps1"
  ],
  "review_scope": {
    "ownership_inventory": null,
    "qualification_record_set": null,
    "owner_reviewer": null,
    "independent_reviewer": null,
    "security_reviewer": null,
    "release_operations_reviewer": null,
    "legal_reviewer": null,
    "support_reviewer": null,
    "review_status": "template_only_no_review",
    "prohibited_placeholder_policy": "Template reviews must not name placeholder reviewers, title-only approvers, aliases without owner-reviewed evidence, or private contact details; a real review must replace null fields with retained evidence beyond the checked no-claim backup-ownership readiness-review template."
  },
  "readiness_status": {
    "owner_reviewed": false,
    "independent_reviewed": false,
    "security_reviewed": false,
    "release_operations_reviewed": false,
    "legal_reviewed": false,
    "support_reviewed": false,
    "all_critical_scopes_reviewed": false,
    "named_backups_reviewed": false,
    "owner_identity_reviewed": false,
    "role_level_reviewed": false,
    "subsystem_competence_reviewed": false,
    "representative_path_coverage_reviewed": false,
    "recent_review_records_verified": false,
    "availability_reviewed": false,
    "succession_reviewed": false,
    "recusal_reviewed": false,
    "inactivity_reviewed": false,
    "removal_reviewed": false,
    "emergency_replacement_reviewed": false,
    "codeowners_reconciled": false,
    "review_rules_reconciled": false,
    "escalation_policy_reconciled": false,
    "repository_access_reviewed": false,
    "stale_access_reviewed": false,
    "ownerless_paths_reviewed": false,
    "primary_only_paths_reviewed": false,
    "two_person_control_reviewed": false,
    "owner_coverage_approved": false,
    "release_authority_approved": false,
    "release_promotion_approved": false,
    "stable_signing_approved": false,
    "update_trust_approved": false,
    "supported_version_changes_approved": false,
    "security_disclosure_approved": false,
    "irreversible_migration_approved": false,
    "legal_approval_supported": false,
    "incident_closure_approved": false,
    "production_authority_approved": false,
    "broad_readiness_approved": false,
    "implementation_claim_supported": false
  },
  "coverage_axes": [
    { "axis": "program", "required_evidence": "Named qualified backup-owner evidence beyond the checked no-claim backup-ownership readiness-review template or explicit blocked status.", "template_status": "missing in template" },
    { "axis": "architecture", "required_evidence": "Named qualified backup-owner evidence beyond the checked no-claim backup-ownership readiness-review template or explicit blocked status.", "template_status": "missing in template" },
    { "axis": "security", "required_evidence": "Named qualified backup-owner evidence beyond the checked no-claim backup-ownership readiness-review template or explicit blocked status.", "template_status": "missing in template" },
    { "axis": "release-operations", "required_evidence": "Named qualified backup-owner evidence beyond the checked no-claim backup-ownership readiness-review template or explicit blocked status.", "template_status": "missing in template" },
    { "axis": "human-release-authority", "required_evidence": "Named qualified backup-owner evidence beyond the checked no-claim backup-ownership readiness-review template or explicit blocked status.", "template_status": "missing in template" },
    { "axis": "incident-response", "required_evidence": "Named qualified backup-owner evidence beyond the checked no-claim backup-ownership readiness-review template or explicit blocked status.", "template_status": "missing in template" },
    { "axis": "legal-community", "required_evidence": "Named qualified backup-owner evidence beyond the checked no-claim backup-ownership readiness-review template or explicit blocked status.", "template_status": "missing in template" },
    { "axis": "support", "required_evidence": "Named qualified backup-owner evidence beyond the checked no-claim backup-ownership readiness-review template or explicit blocked status.", "template_status": "missing in template" },
    { "axis": "quality", "required_evidence": "Named qualified backup-owner evidence beyond the checked no-claim backup-ownership readiness-review template or explicit blocked status.", "template_status": "missing in template" },
    { "axis": "supply-chain", "required_evidence": "Named qualified backup-owner evidence beyond the checked no-claim backup-ownership readiness-review template or explicit blocked status.", "template_status": "missing in template" },
    { "axis": "documentation-research", "required_evidence": "Named qualified backup-owner evidence beyond the checked no-claim backup-ownership readiness-review template or explicit blocked status.", "template_status": "missing in template" },
    { "axis": "product", "required_evidence": "Named qualified backup-owner evidence beyond the checked no-claim backup-ownership readiness-review template or explicit blocked status.", "template_status": "missing in template" },
    { "axis": "platform", "required_evidence": "Named qualified backup-owner evidence beyond the checked no-claim backup-ownership readiness-review template or explicit blocked status.", "template_status": "missing in template" },
    { "axis": "engine", "required_evidence": "Named qualified backup-owner evidence beyond the checked no-claim backup-ownership readiness-review template or explicit blocked status.", "template_status": "missing in template" },
    { "axis": "JavaScript", "required_evidence": "Named qualified backup-owner evidence beyond the checked no-claim backup-ownership readiness-review template or explicit blocked status.", "template_status": "missing in template" },
    { "axis": "networking", "required_evidence": "Named qualified backup-owner evidence beyond the checked no-claim backup-ownership readiness-review template or explicit blocked status.", "template_status": "missing in template" },
    { "axis": "storage", "required_evidence": "Named qualified backup-owner evidence beyond the checked no-claim backup-ownership readiness-review template or explicit blocked status.", "template_status": "missing in template" },
    { "axis": "performance", "required_evidence": "Named qualified backup-owner evidence beyond the checked no-claim backup-ownership readiness-review template or explicit blocked status.", "template_status": "missing in template" },
    { "axis": "accessibility", "required_evidence": "Named qualified backup-owner evidence beyond the checked no-claim backup-ownership readiness-review template or explicit blocked status.", "template_status": "missing in template" },
    { "axis": "UI-runtime", "required_evidence": "Named qualified backup-owner evidence beyond the checked no-claim backup-ownership readiness-review template or explicit blocked status.", "template_status": "missing in template" },
    { "axis": "agent-operations", "required_evidence": "Named qualified backup-owner evidence beyond the checked no-claim backup-ownership readiness-review template or explicit blocked status.", "template_status": "missing in template" },